{
  "version": 2,
  "operation_id": "live-probe-842521ee-11d5-47a5-abd2-06196345d4fc|R2|4e6a1695-1b3e-421b-8743-197d154d4148%3A82b1a08d-7794-4f27-b78b-8386c8ae8565|implement|1",
  "run_id": "live-probe-842521ee-11d5-47a5-abd2-06196345d4fc",
  "task_id": "R2",
  "attempt_id": "4e6a1695-1b3e-421b-8743-197d154d4148",
  "session_id": "d6530eba-f475-4a3a-b843-442f8a0b4e90",
  "stage": "IMPLEMENT",
  "state": "completed",
  "before": "ca6e5bc3602f1d59b3a7f2f1825753103b5ba9f55198a9deb8e912ba72d13090",
  "after": "bbdcf3a07d3e3153053bb11ff74fc3fdd98765d2a2a82d7a72015c4cd37bddd3",
  "result": {
    "status": "PASS",
    "summary": "R2 implemented: divide(a,b) in autodev-probe/app.mjs throws RangeError('Division by zero') when b === 0 (covers -0) and otherwise returns a / b. Only the divide line changed; add, greet and clamp were left untouched (they belong to R1, R3, R4). Smoke-checked inline: divide(8,2)===4, divide(1,0) and divide(1,-0) throw, divide(1,4)===0.25. Acceptance checks R2-test and R2-api were NOT run by this writer; they belong to the independent verifier.",
    "findings": [
      {
        "severity": "minor",
        "message": "Independent Sonnet review (REVIEW stage) and verification of R2-test and R2-api (api-check.mjs real HTTP run) have not been performed yet; this receipt does not establish task PASS."
      },
      {
        "severity": "minor",
        "message": "greet in autodev-probe/app.mjs still lacks trim() (R3 scope, UNVERIFIED); left untouched intentionally because it is out of the R2 sprint contract."
      }
    ],
    "snapshot": {
      "changed_files": [
        "autodev-probe/app.mjs"
      ],
      "change": "divide line only",
      "before_fingerprint": "ca6e5bc3602f1d59b3a7f2f1825753103b5ba9f55198a9deb8e912ba72d13090",
      "attempt": 1,
      "repair_attempt": 0
    }
  },
  "updated_at": "2026-10-26T20:54:27.193Z"
}
