{
  "version": 2,
  "operation_id": "run3|T1|root3%3Ad5f213a3-59d1-4fbb-8523-acbd5a6a3933|checkpoint-failure|2",
  "run_id": "run3",
  "task_id": "T1",
  "attempt_id": "root3",
  "session_id": "8c68fb96-a017-4d2b-a70b-a2d7a9bd8888",
  "stage": "REVIEW",
  "state": "completed",
  "before": "1c8e296f13e21189c0ca4a3b321ba7cc8f4df3d2c826ab374fceb87e21ff0be3",
  "after": "1c8e296f13e21189c0ca4a3b321ba7cc8f4df3d2c826ab374fceb87e21ff0be3",
  "result": {
    "status": "PASS",
    "summary": "Recorded T1 review NEEDS_FIX (app.js line 211 remove(null)) in failure.json as category implementation; failures=4, repair_attempt=1, next_model claude-haiku-5-5, next_action IMPLEMENT.",
    "findings": [
      {
        "severity": "minor",
        "message": "Journal entry is not product acceptance; T1 remains UNVERIFIED and the defect is unrepaired.",
        "resolved": false
      }
    ]
  },
  "updated_at": "2026-10-26T21:09:59.500Z"
}
